{
  "schema_version": 1,
  "event_id": "20261022024140-jeonghan-home-570e8e43",
  "generation_candidate": "20261022024140-jeonghan-home",
  "generation_id": "20261022024140-jeonghan-home",
  "world_slug": "jeonghan-home",
  "media_id": "dns-install",
  "writer": "macos-mbr-last",
  "device_path": "/dev/disk4",
  "repository_revision": "63cd0f4cc0a71311ed239fdfdfe8f3315135f2f6",
  "catalog_tree": "da76b69ad34e5937cb9bb35a83879573478bb7fb",
  "status": "succeeded",
  "started_at": "2026-10-22T02:41:40+09:00",
  "finished_at": "2026-10-22T03:36:54+09:00",
  "exit_code": 0,
  "failure_code": null,
  "target": {
    "display_name": "SanDisk 3.2Gen1",
    "bytes": 30784094208
  },
  "readback": {
    "method": "mbr-last-raw-compare",
    "status": "passed"
  }
}
